<?xml version="1.0" encoding="UTF-8" ?>
<!--
    Document    : ElectionSurvey_schema.xsd
    Author      : vincent
    Description :
        Purpose of the document follows.
-->

<VoterDetails xmlns="http://www.electionsurvey.com"
    xmlns:xsi="http://www.w3.org/2001/XMLSchema-instance"
    xsi:schemaLocation="http://www.electionsurvey.com ElectionSurvey_schema.xsd">
    <VoterName>Halle Brown</VoterName>
    <Gender>Female</Gender>
    <Age>24</Age>
    <DateOfBirth>1982-05-13</DateOfBirth>
    <Professtion>Student</Professtion>
    <PhoneNumber>04024162567</PhoneNumber>
    <Address>378-Park Street</Address>
    <City>4000 Stavanger</City>
<!--    <State>Bergen</State>-->
    <State>Noway</State>
</VoterDetails>
